{
  "objection_type": "source",
  "raw_objection": "Como voces encontraram a clinica?",
  "response_variant": "Encontrei voces no Google pesquisando por clinica odontologica na regiao. Meu contato e comercial: a ideia e mostrar oportunidades simples para melhorar site, WhatsApp e agendamentos. Quem cuida dessa parte por ai?",
  "times_used": 1,
  "reply_rate": 1.0,
  "demo_conversion_rate": 0.0,
  "meeting_conversion_rate": 0.0,
  "close_rate": 0.0,
  "status": "testing",
  "notes": "Exemplo ficticio. Responder a fonte antes de vender."
}
